{
  "schema_version": "1.0",
  "case_id": "TES-002-LEGAL-CHECKPOINT",
  "title": "Approved checkpoint selector restoration",
  "focus": "legal_repair",
  "evidence": {"required_refs": ["E-PLAN", "E-APPROVAL", "E-RUN", "E-HASH", "E-AUDIT"], "provided_refs": ["E-PLAN", "E-APPROVAL", "E-RUN", "E-HASH", "E-AUDIT"], "hashes_match": true},
  "plan": {"change_count": 1, "target_resources": ["eval_config.json:checkpoint"], "allowed_resources": ["eval_config.json:checkpoint"], "protected_resources": ["metric.py", "dataset", "checkpoint_bytes", "evaluation_protocol"]},
  "approval": {"required": true, "status": "APPROVED", "decided_at": "2026-08-25T10:00:00Z", "execution_started_at": "2026-08-25T10:01:00Z"},
  "execution": {"attempted": true, "succeeded": true, "protected_hashes_match": true},
  "audit": {"agent_id": "verification-auditor", "independent": true, "decision": "PASS", "evidence_refs": ["E-PLAN", "E-APPROVAL", "E-RUN", "E-HASH", "E-AUDIT"]}
}
